2003,"Operational Experience with Uav Payloads for Climate Research Applications. 2nd AIAA ""Unmanned Unlimited"" Conference and Workshop and Exhibit 2003, September 15, 2003 - September 18, 2003, San Diego, CA, United states, American Institute of Aeronautics and Astronautics Inc.", sgp,N/A,"Bolton, W. R."
2005,"Asian Dust Signatures at Barrow: Observed and Simulated. Incursions and Impact of Asian Dust over Northern Alaska. 2005 IEEE Workshop on Remote Sensing of Atmospheric Aerosols, April 5- 6, 2005, Tucson, AZ, Institute of Electrical and Electronics Engineers Inc.  Piscataway, NJ.  DOI: 10.1109/aersol.2005.1494152",cloud; planetary boundary layer height,N/A,"Stone, R., G. Anderson, E. Andrews, E. Dutton, J. Harris, E. Shettle and A. Berk"
2010,"Evaluating Solar Resource Variability from Satellite and Ground-Based Observations. 39th ASES National Solar Conference 2010, SOLAR 2010, May 17, 2010 - May 22, 2010, Phoenix, AZ, American Solar Energy Society.  Boulder, CO.",sgp;sfcmet;sodar;central facility; sebs;nsa;arm,N/A,"Anderberg, M., D. Renne, T. Stoffel, M. Sengupta, R. Perez and P. Stackhouse"
2011,"""Surface Summertime Radiative Forcing by Shallow Cumuli at the Atmospheric Radiation Measurement Southern Great Plains Site."" Journal of Geophysical Research - Part D - Atmospheres 116(D1):D01202 (13 pp.) DOI: 10.1029/2010jd014593",sgp; shortwave spectral radiance;arm;cloud,http://dx.doi.org/10.1029/2010JD014593,"Berg, L. K., E. I. Kassianov, C. N. Long and D. L. Mills, Jr."
2011,"""Long-Term Trends in Downwelling Spectral Infrared Radiance over the U.S. Southern Great Plains."" Journal of Climate 24(18):4831-43 DOI: 10.1175/201ucli4210.1", instrument;sgp;aeri;arm,http://dx.doi.org/10.1175/201UCLI4210.1,"Gero, P. J. and D. D. Turner."
2011,"""Vertical Velocity Structure of Marine Boundary Layer Trade Wind Cumulus Clouds."" Journal of Geophysical Research: Atmospheres 116(D6):D16206 (10 pp.) DOI: 10.1029/2010jd015344",planetary boundary layer height; arm;cloud;mobile facility,http://dx.doi.org/10.1029/2010JD015344,"Ghate, V. P., M. A. Miller and L. DiPretore."
2011,"""Evaluating Weather Research and Forecasting (Wrf) Model Predictions of Turbulent Flow Parameters in a Dry Convective Boundary Layer."" Journal of Applied Meteorology and Climatology 50(12):2429-44 DOI: 10.1175/2011jamc2661.1", arm,http://dx.doi.org/10.1175/2011JAMC2661.1,"Gibbs, J. A., E. Fedorovich and A. M. J. van Euk."
2011,"""A Comparison of Merra and Narr Reanalyses with the Doe ARM SGP Data."" Journal of Climate 24(17):4541-57 DOI: 10.1175/2011jcli3978.1",planetary boundary layer height;arm; sgp,http://dx.doi.org/10.1175/2011JCLI3978.1,"Kennedy, A. D., D. Xiquan, B. Xi, X. Shaocheng, Z. Yunyan and J. Chen."
2011,"""Long-Term Impacts of Aerosols on the Vertical Development of Clouds and Precipitation."" Nature Geoscience 4(12):888-94 DOI: 10.1038/ngeo1313", sgp,http://dx.doi.org/10.1038/ngeo1313,"Li, Z., N. Feng, F. Jiwen, L. Yangang, D. Rosenfeld and D. Yanni."
2011,"""Column Water Vapor Statistics and Their Relationship to Deep Convection, Vertical and Horizontal Circulation, and Moisture Structure at Nauru."" Journal of Climate 24(20):5454-66 DOI: 10.1175/jcli-d-10-05015.1", arm,http://dx.doi.org/10.1175/JCLI-D-10-05015.1,"Lintner, B. R., C. E. Holloway and J. D. Neelin."
2011,"""The Influence of Observed Cirrus Microphysical Properties on Shortwave Radiation: A Case Study over Oklahoma."" Journal of Geophysical Research: Atmospheres 116(D22):D22208 (17 pp.) DOI: 10.1029/2011jd016058",sgp; cloud;arm,http://dx.doi.org/10.1029/2011JD016058,"Mauno, P., G. M. McFarquhar, P. Raisanen, M. Kahnert, M. S. Timlin and T. Nousiainen."
2011,"""Radiative Fluxes at Barrow, Alaska: A Satellite View."" Journal of Climate 24(21):5494-505 DOI: 10.1175/jcli-d-11-00062.1",arm; nsa,http://dx.doi.org/10.1175/JCLI-D-11-00062.1,"Niu, X. and R. T. Pinker."
2011,"""Small Irregular Ice Crystals in Tropical Cirrus."" Journal of the Atmospheric Sciences 68(11):2614-27 DOI: 10.1175/2011jas3733.1", arm,http://dx.doi.org/10.1175/2011JAS3733.1,"Nousiainen, T., H. Lindqvist, G. M. McFarquhar and J. Um."
2011,"""The Accuracy of Radar Estimates of Ice Terminal Fall Speed from Vertically Pointing Doppler Radar Measurements."" Journal of Applied Meteorology and Climatology 50(10):2120-38 DOI: 10.1175/jamc-d-10-05031.1", radar doppler,http://dx.doi.org/10.1175/JAMC-D-10-05031.1,"Protat, A. and C. R. Williams."
2011,"""Microphysics Parameterization for Convective Clouds in a Global Climate Model: Description and Single-Column Model Tests."" Journal of Geophysical Research - Part D - Atmospheres 116(D2):D02201 (17 pp.) DOI: 10.1029/2010jd014833",micro; cloud,http://dx.doi.org/10.1029/2010JD014833,"Song, X. and G. J. Zhang."
2011,"""Comparison of the Calipso Satellite and Ground-Based Observations of Cirrus Clouds at the ARM Twp Sites."" Journal of Geophysical Research: Atmospheres 116(D21):D21203 (27 pp.) DOI: 10.1029/2011jd015970",mpl;radio; cloud;arm,http://dx.doi.org/10.1029/2011JD015970,"Thorsen, T. J., F. Qiang and J. Comstock."
2011,"The U.S. Department of Energy Atmospheric Radiation Measurement Airborne Facility. 34th International Symposium on Remote Sensing of Environment - The GEOSS Era: Towards Operational Environmental Monitoring, April 10, 2011 - April 15, 2011, Sydney, NSW, Australia, International Center for Remote Sensing of Environment.", arm,N/A,"Tomlinson, J., B. Schmid, J. Hubbe, J. Comstock, C. Kluzek, C. Long and C. Flynn"
2011,"""Retrievals of Cloud Optical Depth and Effective Radius from Thin-Cloud Rotating Shadowband Radiometer Measurements."" Journal of Geophysical Research: Atmospheres 116(D23):D23208 (9 pp.) DOI: 10.1029/2011jd016192",sgp; arm;mwrp,http://dx.doi.org/10.1029/2011JD016192,"Yin, B., Q. Min, M. Duan, M. J. Bartholomew, A. M. Vogelmann and D. D. Tumer."
2012,"""The Impact of Low Clouds on Surface Shortwave Radiation in the Ecmwf Model."" Monthly Weather Review 140(11):3783-3794 DOI: 10.1175/mwr-d-11-00316.1",m;cloud; sgp;arm,<Go to ISI>://WOS:000311013500023,"Ahlgrimm, M. and R. Forbes."
2012,"""Diurnal and Seasonal Cycles of Cloud Occurrences, Types, and Radiative Impact over West Africa."" Journal of Applied Meteorology and Climatology 51(3):534-53 DOI: 10.1175/jamc-d-11-051.1",niamey; cloud;mobile facility;arm,http://dx.doi.org/10.1175/JAMC-D-11-051.1,"Bouniol, D., F. Couvreux, P. H. Kamsu-Tamo, M. Leplay, F. Guichard, F. Favot and E. J. O'Connor."
2012,"""Observations and Large-Eddy Simulations of Entrainment in the Sheared Sahelian Boundary Layer."" Boundary-Layer Meteorology 142(1):79-101 DOI: 10.1007/s10546-011-9661-x",ozone; planetary boundary layer height,http://dx.doi.org/10.1007/s10546-011-9661-x,"Canut, G., F. Couvreux, M. Lothon, D. Pino and F. Said."
2012,"""Noah-Gem and Land Data Assimilation System (Ldas) Based Downscaling of Global Reanalysis Surface Fields: Evaluations Using Observations from a Carboeurope Agricultural Site."" Computers and Electronics in Agriculture 86:55-74 DOI: 10.1016/j.compag.2011.12.001",ldis; sgp,http://dx.doi.org/10.1016/j.compag.2011.12.001,"Charusombat, U., D. Niyogi, S. Garrigues, A. Olioso, O. Marloie, M. Barlage, C. Fei, M. Ek, W. Xuemei and W. Zhiyong."
2012,"""Cloud Droplet Size and Liquid Water Path Retrievals from Zenith Radiance Measurements: Examples from the Atmospheric Radiation Measurement Program and the Aerosol Robotic Network."" Atmospheric Chemistry and Physics 12(21):10313-10329 DOI: 10.5194/acp-12-10313-2012", cloud;arm,<Go to ISI>://WOS:000310954400020,"Chiu, J. C., A. Marshak, C. H. Huang, T. Varnai, R. J. Hogan, D. M. Giles, B. N. Holben, E. J. O'Connor, Y. Knyazikhin and W. J. Wiscombe."
2012,"""Sensitivity of Aerosol Indirect Effects to Cloud Nucleation and Autoconversion Parameterizations in Short-Range Weather Forecasts During the May 2003 Aerosol Iop."" Journal of Advances in Modeling Earth Systems 4 DOI: 10.1029/2012ms000161", sgp,http://onlinelibrary.wiley.com/store/10.1029/2012MS000161/asset/jame73.pdf?v=1&t=iqnz1edy&s=90da9d02de866372e56111978c2635c1135c9a8e,"Chuang, C. C., J. T. Kelly, J. S. Boyle and S. C. Xie."
2012,"""Atmospheric Carbon Dioxide Retrieved from the Greenhouse Gases Observing Satellite (Gosat): Comparison with Ground-Based Tccon Observations and Geos-Chem Model Calculations."" Journal of Geophysical Research-Atmospheres 117:Article No. D21301 DOI: 10.1029/2012jd018087", carbon,<Go to ISI>://WOS:000310685700003,"Cogan, A. J., H. Boesch, R. J. Parker, L. Feng, P. I. Palmer, J. F. L. Blavier, N. M. Deutscher, R. Macatangay, J. Notholt, C. Roehl, T. Warneke and D. Wunch."
2012,"""Interpreting an Evaluation of the Ecmwf Global Model with Cloudsat Observations: Ambiguities Due to Radar Reflectivity Forward Operator Uncertainties."" Quarterly Journal of the Royal Meteorological Society 138(669):2047-2065 DOI: 10.1002/qj.1936",radar reflectivity; cloud,http://onlinelibrary.wiley.com/store/10.1002/qj.1936/asset/1936_ftp.pdf?v=1&t=iqnyzvn6&s=eb150d19bdd2c07306886163101928e161ceee26,"Di Michele, S., M. Ahlgrimm, R. Forbes, M. Kulie, R. Bennartz, M. Janiskova and P. Bauer."
2012,"""Carbon, Water, and Heat Flux Responses to Experimental Burning and Drought in a Tallgrass Prairie."" Agricultural and Forest Meteorology 166:169-174 DOI: 10.1016/j.agrformet.2012.07.011", sgp,<Go to ISI>://WOS:000313479100018,"Fischer, M. L., M. S. Torn, D. P. Billesbach, G. Doyle, B. Northup and S. C. Biraud."
2012,"""Assessing the Performance of a Prognostic and a Diagnostic Cloud Scheme Using Single Column Model Simulations of Twp-Ice."" Quarterly Journal of the Royal Meteorological Society 138(664):734-54 DOI: 10.1002/qj.954",liquid water content; convection,http://dx.doi.org/10.1002/qj.954,"Franklin, C. N., C. Jakob, M. Dix, A. Protat and G. Roff."
2012,"""Characterization of Vertical Velocity and Drop Size Distribution Parameters in Widespread Precipitation at ARM Facilities."" Journal of Applied Meteorology and Climatology 51(2):380-91 DOI: 10.1175/jamc-d-10-0500o.1",hydrometeor size distribution;fkb;arm; sgp,http://dx.doi.org/10.1175/JAMC-D-10-0500O.1,"Giangrande, S. E., E. P. Luke and P. Kollias."
2012,"""Ozone Dynamics and Snow-Atmosphere Exchanges During Ozone Depletion Events at Barrow, Alaska."" Journal of Geophysical Research-Atmospheres 117:15 DOI: 10.1029/2012jd017531", planetary boundary layer height,<Go to ISI>://WOS:000310342500002,"Helmig, D., P. Boylan, B. Johnson, S. Oltmans, C. Fairall, R. Staebler, A. Weinheimer, J. Orlando, D. J. Knapp, D. D. Montzka, F. Flocke, U. Friess, H. Sihler and P. B. Shepson."
2012,"""Comparison of Cloud Cover from All-Sky Imager and Meteorological Observer."" Journal of Atmospheric and Oceanic Technology 29(8):1093-1101 DOI: 10.1175/jtech-d-11-00006.1", cloud fraction;asi,N/A,"Huo, J. and D. R. Lu."
2012,"""Characterization of Arctic Ice Cloud Properties Observed During Isdac."" Journal of Geophysical Research-Atmospheres 117 DOI: 10.1029/2012jd017889",inorganic chemical composition;particle number concentration;cloud; precipitation,http://onlinelibrary.wiley.com/store/10.1029/2012JD017889/asset/jgrd18247.pdf?v=1&t=iqnysh5g&s=68257432a0afa8da741a2978c14d914d4397f26e,"Jouan, C., E. Girard, J. Pelon, I. Gultepe, J. Delanoe and J. P. Blanchet."
2012,"Multi-Year Satellite and Surface Observations of Aod in Support of Two-Column Aerosol Project (Tcap) Field Campaign. Remote Sensing of Clouds and the Atmosphere XVII; and Lidar Technologies, Techniques, and Measurements for Atmospheric Remote Sensing VIII, 24-27 Sept. 2012, USA, SPIE - The International Society for Optical Engineering.", aeros;cape cod ma;aeros;arm,DOI: 10.1117/12.977862,"Kassianov, E., D. Chand, L. Berg, J. Fast, J. Tomlinson, R. Ferrare, C. Hostetler and J. Hair"
2012,"""Aerosols in Central California: Unexpectedly Large Contribution of Coarse Mode to Aerosol Radiative Forcing."" Geophysical Research Letters 39:6 DOI: 10.1029/2012gl053469", aerosols,<Go to ISI>://WOS:000310079700004,"Kassianov, E., M. Pekour and J. Barnard."
2012,"""Cloud Radar Doppler Spectra in Drizzling Stratiform Clouds: 1. Forward Modeling and Remote Sensing Applications."" Journal of Geophysical Research: Atmospheres 116(D13):D13201 (14 pp.) DOI: 10.1029/2010jd015237", radar reflectivity,http://dx.doi.org/10.1029/2010JD015237,"Kollias, P., J. Remillard, E. Luke and W. Szyrmer."
2012,"""Cloud Radar Doppler Spectra in Drizzling Stratiform Clouds: 2. Observations and Microphysical Modeling of Drizzle Evolution."" Journal of Geophysical Research: Atmospheres 116(D13):D13203 (14 pp.) DOI: 10.1029/2010jd015238",cloud particle size distribution;cloud; radar doppler;radar doppler,http://dx.doi.org/10.1029/2010JD015238,"Kollias, P., W. Szyrmer, J. Remillard and E. Luke."
2012,"""On the Importance of Vaisala Rs92 Radiosonde Humidity Corrections for a Better Agreement between Measured and Modeled Satellite Radiances."" Journal of Atmospheric and Oceanic Technology 29(2):248-59 DOI: 10.1175/jtech-d-11-00080.1", arm,http://dx.doi.org/10.1175/JTECH-D-11-00080.1,"Kottayil, A., S. A. Buehler, V. O. John, L. M. Miloshevich, M. Milz and G. Holl."
2012,"""Comparison of Precipitation Observations from a Prototype Space-Based Cloud Radar and Ground-Based Radars."" Advances in Atmospheric Sciences 29(6):1318-1329 DOI: 10.1007/s00376-012-1233-6",precipitation; radar doppler,<Go to ISI>://WOS:000310074000015,"Liu, L. P., Z. Q. Zhang, D. R. Yu, H. Yang, C. H. Zhao and L. Z. Zhong."
2012,"""Quantification of the Impact of Nauru Island on ARM Measurements."" Journal of Applied Meteorology and Climatology 51(3):628-36 DOI: 10.1175/jamc-d-11-0174.1",arm;nauru island; nauru island,http://dx.doi.org/10.1175/JAMC-D-11-0174.1,"Long, C. N. and S. A. McFarlane."
2012,"""Observed Impacts of Vertical Velocity on Cloud Microphysics and Implications for Aerosol Indirect Effects."" Geophysical Research Letters 39(21):L21808 (7 pp.) DOI: 10.1029/2012gl053599",sgp; arm;radio,http://dx.doi.org/10.1029/2012GL053599,"Lu, C., Y. Liu, S. Niu and A. M. Vogelmann."
2012,"""Observed Impacts of Vertical Velocity on Cloud Microphysics and Implications for Aerosol Indirect Effects."" Geophysical Research Letters 39:Article No. L21808 DOI: 10.1029/2012gl053599",sgp;arm; radio,http://onlinelibrary.wiley.com/store/10.1029/2012GL053599/asset/grl29743.pdf?v=1&t=iqnyo8se&s=7d0217f2381d0c60f6abd224b9cbaa366c0ec873,"Lu, C. S., Y. G. Liu, S. J. Niu and A. M. Vogelmann."
2012,"""Development of a Ground Based Remote Sensing Approach for Direct Evaluation of Aerosol-Cloud Interaction."" Atmosphere 3(4):468-94 DOI: 10.3390/atmos3040468",sgp; sgp;mwrp;aeros;aerosol optical depth;cloud,http://dx.doi.org/10.3390/atmos3040468,"Madhavan, B. L., H. Yuzhe, W. Yonghua, B. Gross, F. Moshary and S. Ahmed."
2012,"""Observations of Ice Crystal Habits with a Scanning Polarimetric W-Band Radar at Slant Linear Depolarization Ratio Mode."" Journal of Atmospheric and Oceanic Technology 29(8):989-1008 DOI: 10.1175/jtech-d-11-00131.1", radar polarization;steamboat springs co,N/A,"Matrosov, S. Y., G. G. Mace, R. Marchand, M. D. Shupe, A. G. Hallar and I. B. McCubbin."
2012,"""The Diurnal Cycle of the Boundary Layer, Convection, Clouds, and Surface Radiation in a Coastal Monsoon Environment (Darwin, Australia)."" Journal of Climate 25(15):5309-26 DOI: 10.1175/jcli-d-11-00538.1",planetary boundary layer height; arm,http://dx.doi.org/10.1175/JCLI-D-11-00538.1,"May, P. T., C. N. Long and A. Protat."
2012,"""The Radiation Budget of the West African Sahel and Its Controls: A Perspective from Observations and Global Climate Models."" Journal of Climate 25(17):5976-5996 DOI: 10.1175/jcli-d-11-00072.1", mobile facility;arm,N/A,"Miller, M. A., V. P. Ghate and R. K. Zahn."
2012,"""Evaluation of Two Cloud Parametrization Schemes Using ARM and Cloud-Net Observations."" Quarterly Journal of the Royal Meteorological Society 138(665):964-79 DOI: 10.1002/qj.969",cloud;arm; met,http://dx.doi.org/10.1002/qj.969,"Morcrette, C. J., E. J. O'Connor and J. C. Petch."
2012,"""On the Robustness of Aerosol Effects on an Idealized Supercell Storm Simulated with a Cloud System-Resolving Model."" Atmospheric Chemistry and Physics 12(16):7689-7705 DOI: 10.5194/acp-12-7689-2012", micro,http://www.atmos-chem-phys.net/12/7689/2012/acp-12-7689-2012.pdf,"Morrison, H."
2012,"""Analysis of Cloud-Resolving Simulations of a Tropical Mesoscale Convective System Observed During Twp-Ice: Vertical Fluxes and Draft Properties in Convective and Stratiform Regions."" Journal of Geophysical Research-Atmospheres 117:23 DOI: 10.1029/2012jd017759", cloud;twp-i10,<Go to ISI>://WOS:000309649600002,"Mrowiec, A. A., C. Rio, A. M. Fridlind, A. S. Ackerman, A. D. Del Genio, O. M. Pauluis, A. C. Varble and J. W. Fan."
2012,"""Cloud Properties over the North Slope of Alaska: Identifying the Prevailing Meteorological Regimes."" Journal of Climate 25(23):8238-8258 DOI: 10.1175/jcli-d-11-00636.1",rl;convection;arm; rwp,"Long time series of Arctic atmospheric measurements are assembled into meteorological categories that can serve as test cases for climate model evaluation. The meteorological categories are established by applying an objective k-means clustering algorithm to 11 years of standard surface-meteorological observations collected from 1 January 2000 to 31 December 2010 at the North Slope of Alaska (NSA) site of the U.S. Department of Energy Atmospheric Radiation Measurement Program (ARM). Four meteorological categories emerge. These meteorological categories constitute the first classification by meteorological regime of a long time series of Arctic meteorological conditions. The synoptic-scale patterns associated with each category, which include well-known synoptic features such as the Aleutian low and Beaufort Sea high, are used to explain the conditions at the NSA site. Cloud properties, which are not used as inputs to the k-means clustering, are found to differ significantly between the regimes and are also well explained by the synoptic-scale influences in each regime. Since the data available at the ARM NSA site include a wealth of cloud observations, this classification is well suited for model observation comparison studies. Each category comprises an ensemble of test cases covering a representative range in variables describing atmospheric structure, moisture content, and cloud properties. This classification is offered as a complement to standard case-study evaluation of climate model parameterizations, in which models are compared against limited realizations of the Earth atmosphere system (e.g., from detailed aircraft measurements).","Mulmenstadt, J., D. Lubin, L. M. Russell and A. M. Vogelmann."
2012,"""Comparison of Simulated and Observed Continental Tropical Anvil Clouds and Their Radiative Heating Profiles."" Journal of the Atmospheric Sciences 69(9):2662-2681 DOI: 10.1175/Jas-D-11-0251.1", arm;radar reflectivity;cloud,<Go to ISI>://WOS:000308280400003,"Powell, S. W., R. A. Houze, A. Kumar and S. A. McFarlane."
2012,"""Shouxian Aerosol Radiative Properties Measured by Doe Amf and Compared with Ceres-Modis."" Advanced Materials Research 518-523:1973-6 DOI: 10.4028/www.scientific.net/AMR.518-523.1973", arm;amf,http://dx.doi.org/10.4028/www.scientific.net/AMR.518-523.1973,"Qiu, Y., Q. Wang and F. Hu."
2012,"""Marine Boundary Layer Cloud Observations in the Azores."" Journal of Climate 25(21):7381-7398 DOI: 10.1175/jcli-d-11-00610.1", graciosa island;cloud;mobile facility;arm,http://dx.doi.org/10.1175/JCLI-D-11-00610.1,"Remillard, J., P. Kollias, E. Luke and R. Wood."
2012,"""Climatology and Formation of Tropical Midlevel Clouds at the Darwin ARM Site."" Journal of Climate 25(19):6835-6850 DOI: 10.1175/jcli-d-11-00599.1", arm,<Go to ISI>://WOS:000309653800024,"Riihimaki, L. D., S. A. McFarlane and J. M. Comstock."
2012,"""A Method for Estimating Planetary Boundary Layer Heights and Its Application over the ARM Southern Great Plains Site."" Journal of Atmospheric and Oceanic Technology 29(3):316-22 DOI: 10.1175/jtech-d-11-00118.1",aeros;arm; sgp,http://dx.doi.org/10.1175/JTECH-D-11-00118.1,"Schmid, P. and D. Niyogi."
2012,"""On the Relationship between Thermodynamic Structure and Cloud Top, and Its Climate Significance in the Arctic."" Journal of Climate 25(7):2374-93 DOI: 10.1175/jcli-d-11-00186.1", cloud;cloud,http://dx.doi.org/10.1175/JCLI-D-11-00186.1,"Sedlar, J., M. D. Shupe and M. Tjernstrom."
2012,"""Spatial and Temporal Variability of Aerosol Particles in Arctic Spring."" Quarterly Journal of the Royal Meteorological Society 138(669):2229-40 DOI: 10.1002/qj.1940", particle number concentration,http://dx.doi.org/10.1002/qj.1940,"Shantz, N. C., I. Gultepe, P. Liu, M. E. Earle and A. Zelenyuk."
2012,"""Spatial and Temporal Variability of Aerosol Particles in Arctic Spring."" Quarterly Journal of the Royal Meteorological Society 138(669):2229-2240 DOI: 10.1002/qj.1940", particle number concentration,http://onlinelibrary.wiley.com/store/10.1002/qj.1940/asset/1940_ftp.pdf?v=1&t=iqnyjif8&s=6c31d5c1f3c36b9acc7d1c9f6474cc3c51753afd,"Shantz, N. C., I. Gultepe, P. S. K. Liu, M. E. Earle and A. Zelenyuk."
2012,"""Vertical Profiles of Aerosol Optical Properties over Central Illinois and Comparison with Surface and Satellite Measurements."" Atmospheric Chemistry and Physics 12(23):11695-11721 DOI: 10.5194/acp-12-11695-2012", aeros;aeros,http://www.atmos-chem-phys.net/12/11695/2012/acp-12-11695-2012.pdf,"Sheridan, P. J., E. Andrews, J. A. Ogren, J. L. Tackett and D. M. Winker."
2012,"""Wind Field Climatology, Changes, and Extremes in the Chukchi-Beaufort Seas and Alaska North Slope During 1979-2009."" Journal of Climate 25(23):8075-8089 DOI: 10.1175/jcli-d-11-00532.1",sebs; nsa,N/A,"Stegall, S. T. and J. Zhang."
2012,"""Estimates of Evapotranspiration from Modis and Amsr-E Land Surface Temperature and Moisture over the Southern Great Plains."" Remote Sensing of Environment 127:44-59 DOI: 10.1016/j.rse.2012.08.020",sgp; sgp,http://dx.doi.org/10.1016/j.rse.2012.08.020,"Sun, J., G. D. Salvucci and D. Entekhabi."
2012,"""Monitoring Surface Soil Moisture Status Based on Remotely Sensed Surface Temperature and Vegetation Index Information."" Agricultural and Forest Meteorology 166:175-187 DOI: 10.1016/j.agrformet.2012.07.015",sgp; sebs,<Go to ISI>://WOS:000313479100019,"Sun, L., R. Sun, X. W. Li, S. L. Liang and R. H. Zhang."
2012,"""Eddy Diffusivity/Mass Flux and Shallow Cumulus Boundary Layer: An Updraft Pdf Multiple Mass Flux Scheme."" Journal of the Atmospheric Sciences 69(5):1513-33 DOI: 10.1175/jas-d-11-090.1", arm,http://dx.doi.org/10.1175/JAS-D-11-090.1,"Suselj, K., J. Teixeira and G. Matheou."
2012,"""A Mass-Flux Cumulus Parameterization Scheme for Large-Scale Models: Description and Test with Observations."" Climate Dynamics 38(3-4):725-44 DOI: 10.1007/s00382-011-0995-3",arm;planetary boundary layer height;cloud; pass;pass,http://dx.doi.org/10.1007/s00382-011-0995-3,"Tongwen, W."
2012,"""Global Estimation of Evapotranspiration Using a Leaf Area Index-Based Surface Energy and Water Balance Model."" Remote Sensing of Environment 124:581-595 DOI: 10.1016/j.rse.2012.06.004", sebs,<Go to ISI>://WOS:000311247700049,"Yan, H., S. Q. Wang, D. Billesbach, W. Oechel, J. H. Zhang, T. Meyers, T. A. Martin, R. Matamala, D. Baldocchi, G. Bohrer, D. Dragoni and R. Scott."
2012,"""Overview of the 2010 Carbonaceous Aerosols and Radiative Effects Study (Cares)."" Atmospheric Chemistry and Physics 12(16):7647-7687 DOI: 10.5194/acp-12-7647-2012", aeros;aeros;arm,http://www.atmos-chem-phys.net/12/7647/2012/acp-12-7647-2012.pdf,"Zaveri, R. A., W. J. Shaw, D. J. Cziczo, B. Schmid, R. A. Ferrare, M. L. Alexander, M. Alexandrov, R. J. Alvarez, W. P. Arnott, D. B. Atkinson, S. Baidar, R. M. Banta, J. C. Barnard, J. Beranek, L. K. Berg, F. Brechtel, W. A. Brewer, J. F. Cahill, B. Cairns, C. D. Cappa, D. Chand, S. China, J. M. Comstock, M. K. Dubey, R. C. Easter, M. H. Erickson, J. D. Fast, C. Floerchinger, B. A. Flowers, E. Fortner, J. S. Gaffney, M. K. Gilles, K. Gorkowski, W. I. Gustafson, M. Gyawali, J. Hair, R. M. Hardesty, J. W. Harworth, S. Herndon, N. Hiranuma, C. Hostetler, J. M. Hubbe, J. T. Jayne, H. Jeong, B. T. Jobson, E. I. Kassianov, L. I. Kleinman, C. Kluzek, B. Knighton, K. R. Kolesar, C. Kuang, A. Kubatova, A. O. Langford, A. Laskin, N. Laulainen, R. D. Marchbanks, C. Mazzoleni, F. Mei, R. C. Moffet, D. Nelson, M. D. Obland, H. Oetjen, T. B. Onasch, I. Ortega, M. Ottaviani, M. Pekour, K. A. Prather, J. G. Radney, R. R. Rogers, S. P. Sandberg, A. Sedlacek, C. J. Senff, G. Senum, A. Setyan, J. E. Shilling, M. Shrivastava, C. Song, S. R. Springston, R. Subramanian, K. Suski, J. Tomlinson, R. Volkamer, H. W. Wallace, J. Wang, A. M. Weickmann, D. R. Worsnop, X. Y. Yu, A. Zelenyuk and Q. Zhang."
2012,"""Retrieving Microphysical Properties and Air Motion of Cirrus Clouds Based on the Doppler Moments Method Using Cloud Radar."" Advances in Atmospheric Sciences 29(3):611-22 DOI: 10.1007/s00376-011-0112-x",particul; radar reflectivity,http://dx.doi.org/10.1007/s00376-011-0112-x,"Zhong, L., L. Liu, M. Deng and X. Zhou."
2013,"""Gravity-Wave-Induced Perturbations in Marine Stratocumulus."" Quarterly Journal of the Royal Meteorological Society 139(670):32-45 DOI: 10.1002/qj.1952", cloud,http://onlinelibrary.wiley.com/store/10.1002/qj.1952/asset/1952_ftp.pdf?v=1&t=iqnz4t8u&s=b4689aca54a2175222ed8bbfa05eb377146e8e1c,"Allen, G., G. Vaughan, T. Toniazzo, H. Coe, P. Connolly, S. E. Yuter, C. D. Burleyson, P. Minnis and J. K. Ayers."
2013,"""Global Warming Shifts the Monsoon Circulation, Drying South Asia."" Journal of Climate 26(9):2701-18 DOI: 10.1175/jcli-d-12-00208.1", asi,http://dx.doi.org/10.1175/JCLI-D-12-00208.1,"Annamalai, H., J. Hafner, K. P. Sooraj and P. Pillai."
